{
	"$schema": "gamestate.schema.json",
	"boardID": "board1",
	"players": ["mrx", "det1", "det2"],
	"starts": [4,1,0],
	"turns": [
		[
			{"ticket": 0, "target": 3},
			{"ticket": 0, "target": 4},
			{"ticket": 2, "target": 2}
		],
		[
			{"firstTicket": 2, "firstTarget": 1, "secondTicket": 1, "secondTarget": 0}
		]
	]
}